{
  "schema_version": 2,
  "date": "2026-07-12",
  "generated_at": "2026-07-12T08:32:50+00:00",
  "followee_count": 166,
  "events_collected": 41,
  "trending_available": true,
  "trending_source_date": "2026-07-12",
  "circle_hot": [],
  "trending_overlap": [],
  "releases": [],
  "new_repos": [],
  "starred_repos_total": 1,
  "raw_counts": {
    "WatchEvent": 1,
    "PushEvent": 39,
    "CreateEvent": 1
  },
  "follows": {
    "new_count": 0,
    "unfollow_count": 0,
    "items": [],
    "unfollows": [],
    "truncated_users": [
      "WBGlIl",
      "yetone"
    ],
    "incomplete": true,
    "degraded": false
  },
  "stars": {
    "total": 1,
    "items": [
      {
        "repo": "0avx/0avx.github.io",
        "repo_url": "https://github.com/0avx/0avx.github.io",
        "by": "safedv",
        "by_url": "https://github.com/safedv",
        "html_url": "https://github.com/0avx/0avx.github.io",
        "text": "safedv starred 0avx/0avx.github.io",
        "created_at": "2026-07-12T06:57:07Z",
        "trending": false,
        "trending_front_page": false
      }
    ]
  },
  "forks": [],
  "feed_item_count": 1
}
